{
  "blocks": [
    {
      "block_id": "blk_e16a35b4c54a77e180a08135",
      "block_type": "paragraph",
      "normalized_text": "r\nREGISTERED JIm. DL-{N)0.4fOOIl1/20OJ-09\n_...I\nCfi1\n~h~ ~a~ette (j{ ~i4....\"\"\"EXTRAORDINARY\n1{flT n- 1JlI'I\" 1\nPARTn-Sectioo 1\n_ .. 1R01lr.l\nPUBUSHED BY AUTIiORrIY\n-.;. 131\nNo. B)\n':ri~. ,@w!'llcm,~ 5, 2009 /16 lUtl, 1930\nNEW DELHI. THURSDAY,FEBRUARV5. 2009/16 Magba, 1930\nl\" 'Il'I ~ 1'R'l\" _ \"<t \"I11!lt _ 10; 'l( \"\"'\" ....... .., ... ~ \"\"'\" .... I\nSePlrttl pili\", Is ch~n 10 this '1ft in order Ihlt it lilly M filed as. sepante c.ompilltion.\nMJNISTRY OF LAW AND JUSTICE\n(Legislative Department)\nNew Delhi. the 5th February,2009/Magha16. 1930 (Salca)\nThe following Act of Parliament received the assent of the President on the\n5th February, 2009, and is hereby published for general infonnation:-\nDiE INFORMATIONTECHNOLOGY(AMENDMENT)ACT, 2008\nNo. 10 OF 2009\n[5th February, 2009.)\nAnAct furtherto amend the InfonnationTechnologyAct, 2000.\nBE it enaetedby Parliamentin the Fifty-ninthYearof the RepublicoflndJaas: follows:­\nPART I\n\\ PRELIMINARY\nI. (I) This Act may be called the Information Technology (Amendment) Act,\n2008.\nSholl {ilk and\n(2)11 shallcome intoforceon such dal~ as th~ CenU'll.lGovernmentmay.by notification\nin theOfficialGa:zene.appoint:\nProvidedthai differentdalesmaybe appoimed fot differentprovisions of thisAcl and\nany referencein any such pro\\'ision 10 the comm~ncemenl of this Act shall be construedas\na referenceLO the coming into force of thai provision.\nl",
      "ordinal": 0,
      "raw_text": "r\nREGISTERED JIm. DL-{N)0.4fOOIl1/20OJ-09\n_...I\nCfi1\n~h~ ~a~ette (j{ ~i4....\"\"\"EXTRAORDINARY\n1{flT n- 1JlI'I\" 1\nPARTn-Sectioo 1\n_ .. 1R01lr.l\nPUBUSHED BY AUTIiORrIY\n-.;. 131\nNo. B)\n':ri~. ,@w!'llcm,~ 5, 2009 /16 lUtl, 1930\nNEW DELHI. THURSDAY,FEBRUARV5. 2009/16 Magba, 1930\nl\" 'Il'I ~ 1'R'l\" _ \"<t \"I11!lt _ 10; 'l( \"\"'\" ....... .., ... ~ \"\"'\" .... I\nSePlrttl pili\", Is ch~n 10 this '1ft in order Ihlt it lilly M filed as. sepante c.ompilltion.\nMJNISTRY OF LAW AND JUSTICE\n(Legislative Department)\nNew Delhi. the 5th February,2009/Magha16. 1930 (Salca)\nThe following Act of Parliament received the assent of the President on the\n5th February, 2009, and is hereby published for general infonnation:-\nDiE INFORMATIONTECHNOLOGY(AMENDMENT)ACT, 2008\nNo. 10 OF 2009\n[5th February, 2009.)\nAnAct furtherto amend the InfonnationTechnologyAct, 2000.\nBE it enaetedby Parliamentin the Fifty-ninthYearof the RepublicoflndJaas: follows:­\nPART I\n\\ PRELIMINARY\nI. (I) This Act may be called the Information Technology (Amendment) Act,\n2008.\nSholl {ilk and\n(2)11 shallcome intoforceon such dal~ as th~ CenU'll.lGovernmentmay.by notification\nin theOfficialGa:zene.appoint:\nProvidedthai differentdalesmaybe appoimed fot differentprovisions of thisAcl and\nany referencein any such pro\\'ision 10 the comm~ncemenl of this Act shall be construedas\na referenceLO the coming into force of thai provision.\nl",
      "source_anchor": "pdf:page:1",
      "structural_path": [
        "page:1"
      ]
    },
    {
      "block_id": "blk_3356c9641ad7ead9bd763c6b",
      "block_type": "paragraph",
      "normalized_text": "SEC. IJ TIlE GAZE1TEOF INDIA EXTRAORDINARY 5\nJO. In section 12 afme principalAct, in sub-section(I), for the words\"agreed with the\naddressee\", the word \"stipulated\" shall be substituted.\n11. For sections 15 and 16 of the principal Act, the following sections shall be\nsubstituted. namcly:-\n'IS. An deC-trunK:signatureshall be deemed to be a secure electronicsignature\nif-\n(,) thesignaturecreationdata,at the time of atrwng signature,\"''as under\nthe exclusive cOlltrolof signatory and no other person; and\n(il) the signature creation data was stored and affixed in such exclusive\nmanneras may be prescribed.\nExpIQllQljon.-ln caseof digital signature,the\"signaturecreationdara\" means\nthe private key orth.: subsaiber.\n16. The Central Governmentmay, for the purposes of sections 14 and IS.\nprescribethe securityproceduresand practices:\nProvided that in prescribingsuch security proceduresand practices, the Central\nGovernmentshall haveregardto thecommercial circumstances,nature oftransaetions\nand such other related factorsItS it may consider appropriate.'.\n12. In section 17 of the principalAct,-\n(a) in sub·section (/), for the words \"and Assistant Controllers\", the words\n\", Assistant Conr.rollers,other officers and employees\" shall be subrtiuted; and\n(b) in sub-stC1ion(4), for the words \"and Assistant Controllers\", the words\n\", Assistant Controllers,other otrtCen and employees\" shall be substituted....\n13. Section 20 oflhc:principalAct shall be omined..\n14. In section 29 of the principal Act, in sub-section (/), for the words \"any\nconuavention of the provisions of this Act, rules or regulations made thereunder\", the\nwords \"any contra\\lC'ntionof the provisions of this Chapter\" shall be substituted.\nIS. In section 30 ofthe principIlIAct,-\n(,) in clause(c), after the word \"assured\", the word \"and\" shall be omitted;\n(il) after clause(e), the followingclauses shall be insened, rwnely:-\n\"(CD)be the repositoryofall Electronic Signalurt cmi6eates issued under\nthis Act;\n(cb) publish infonnation regarding iu practices, EI~onic Signature\nCertificates and current SlaNS of such cenificates; and\".\n16. In section34 ofthe principalAct, in sub·section (I), in clause(a), the words\"which\ncontains the public key correspondingto the private key used by that CertifyingAuthority\nto digitally sign another Digital SignatureCertificate\" shall be omitted.\n17. In section 35 of the principalAct, in sub-section (4),-\n\\(a) the first provisoshall be omitted;\n(b) in thesecond proviso,for the words \"Provided furtber\",lhe word \"Provided\"\nshall be substituted.\n18. In seamn 36 of the principalAct, after clause (c), the following clauses shall be\ninserted, namely:-\n\"(co) the subscriber holds a private key which is capable of creating a digital\nsignature;\n(cb) the public key to be listed in the certificate can be used to verify a digital\nsignatllTeaffixed by the pri\\l8lekey held by the subscriber,\".\nAmendment\nor s«lion 12.\nSubstllutionor\nnew setlionl\nror setlioas\nIS ud 16\ns==ele:clronlc\nsip.atulc\nAmendmcnt or\nsection 17\nOmissioa or\nscetion 20\nAmeodmenl or\nsetlion 29\nAmendmenl or\nscellon )0\nAmendmcnl or\nsectIOn 14.\nAmelldment or\nSecliOll 3~\nAmc:ndmCIIIor\nseellon 36",
      "ordinal": 4,
      "raw_text": "SEC. IJ TIlE GAZE1TEOF INDIA EXTRAORDINARY 5\nJO. In section 12 afme principalAct, in sub-section(I), for the words\"agreed with the\naddressee\", the word \"stipulated\" shall be substituted.\n11. For sections 15 and 16 of the principal Act, the following sections shall be\nsubstituted. namcly:-\n'IS. An deC-trunK:signatureshall be deemed to be a secure electronicsignature\nif-\n(,) thesignaturecreationdata,at the time of atrwng signature,\"''as under\nthe exclusive cOlltrolof signatory and no other person; and\n(il) the signature creation data was stored and affixed in such exclusive\nmanneras may be prescribed.\nExpIQllQljon.-ln caseof digital signature,the\"signaturecreationdara\" means\nthe private key orth.: subsaiber.\n16. The Central Governmentmay, for the purposes of sections 14 and IS.\nprescribethe securityproceduresand practices:\nProvided that in prescribingsuch security proceduresand practices, the Central\nGovernmentshall haveregardto thecommercial circumstances,nature oftransaetions\nand such other related factorsItS it may consider appropriate.'.\n12. In section 17 of the principalAct,-\n(a) in sub·section (/), for the words \"and Assistant Controllers\", the words\n\", Assistant Conr.rollers,other officers and employees\" shall be subrtiuted; and\n(b) in sub-stC1ion(4), for the words \"and Assistant Controllers\", the words\n\", Assistant Controllers,other otrtCen and employees\" shall be substituted....\n13. Section 20 oflhc:principalAct shall be omined..\n14. In section 29 of the principal Act, in sub-section (/), for the words \"any\nconuavention of the provisions of this Act, rules or regulations made thereunder\", the\nwords \"any contra\\lC'ntionof the provisions of this Chapter\" shall be substituted.\nIS. In section 30 ofthe principIlIAct,-\n(,) in clause(c), after the word \"assured\", the word \"and\" shall be omitted;\n(il) after clause(e), the followingclauses shall be insened, rwnely:-\n\"(CD)be the repositoryofall Electronic Signalurt cmi6eates issued under\nthis Act;\n(cb) publish infonnation regarding iu practices, EI~onic Signature\nCertificates and current SlaNS of such cenificates; and\".\n16. In section34 ofthe principalAct, in sub·section (I), in clause(a), the words\"which\ncontains the public key correspondingto the private key used by that CertifyingAuthority\nto digitally sign another Digital SignatureCertificate\" shall be omitted.\n17. In section 35 of the principalAct, in sub-section (4),-\n\\(a) the first provisoshall be omitted;\n(b) in thesecond proviso,for the words \"Provided furtber\",lhe word \"Provided\"\nshall be substituted.\n18. In seamn 36 of the principalAct, after clause (c), the following clauses shall be\ninserted, namely:-\n\"(co) the subscriber holds a private key which is capable of creating a digital\nsignature;\n(cb) the public key to be listed in the certificate can be used to verify a digital\nsignatllTeaffixed by the pri\\l8lekey held by the subscriber,\".\nAmendment\nor s«lion 12.\nSubstllutionor\nnew setlionl\nror setlioas\nIS ud 16\ns==ele:clronlc\nsip.atulc\nAmendmcnt or\nsection 17\nOmissioa or\nscetion 20\nAmeodmenl or\nsetlion 29\nAmendmenl or\nscellon )0\nAmendmcnl or\nsectIOn 14.\nAmelldment or\nSecliOll 3~\nAmc:ndmCIIIor\nseellon 36",
      "source_anchor": "pdf:page:5",
      "structural_path": [
        "page:5"
      ]
    }
  ],
  "encoding": null,
  "media_type": "application/pdf",